{
  "schema": "ualf-dataset/v1.2",
  "dataset_id": "ualf-example-dataset-001",
  "created_at": "2026-08-02T18:00:11.000Z",
  "trace_schema": "ualf-trace/v1.1",
  "export_profile": "full",
  "intended_uses": [
    "format evaluation",
    "tool-use pipeline integration testing"
  ],
  "prohibited_uses": [],
  "traces": [
    {
      "trajectory_id": "traj-2026-08-02-demo-001",
      "path": "example-trajectory.jsonl",
      "sha256": "7f4a640390689408230b251ac5ca838b1b731face9f331dab140a482229dede8",
      "bytes": 22062,
      "capture": {
        "mode": "synthetic",
        "generator": "build_example.py",
        "reason": "Deterministic conformance fixture; no live producer loss boundary exists."
      },
      "amendments": {
        "state": "none",
        "as_of": "2026-08-02T18:00:11.000Z",
        "count": 0
      },
      "retention": {
        "mode": "package",
        "retention_class": "synthetic-fixture",
        "expires_at": null,
        "erasure_method": "retain"
      },
      "revocation": {
        "status": "active",
        "checked_at": "2026-08-02T18:00:11.000Z",
        "authority": "UALF demo maintainer"
      },
      "hygiene_evidence": {
        "path": "example-hygiene-report.json",
        "sha256": "ab88be3b91bb8f458891c4cbc62f0cb67ef6577a658d12986f97b94a3c13067c",
        "bytes": 1173
      },
      "replay_evidence": {
        "path": "example-replay-verification.json",
        "sha256": "4238d7675a756deb4a860af64ef29e069609ea04496d0687b650f67cf444c8af",
        "bytes": 905
      },
      "external_dependencies": []
    }
  ],
  "blobs": [
    {
      "path": "blobs/1c41c788f8f18ff81e26841cbaf16e54cfc13bc7143209d60c0e08e716f6c399",
      "sha256": "1c41c788f8f18ff81e26841cbaf16e54cfc13bc7143209d60c0e08e716f6c399",
      "bytes": 128
    },
    {
      "path": "blobs/62df8d8ad0d4ce50242e7ed8f1d47c62aacdf2f650d97efc0fb1a726a565d706",
      "sha256": "62df8d8ad0d4ce50242e7ed8f1d47c62aacdf2f650d97efc0fb1a726a565d706",
      "bytes": 98
    },
    {
      "path": "blobs/6ccccc9e22531fcc92d0ef7c9d718c1c813507ac17c6b3a7e7a64bd419237f05",
      "sha256": "6ccccc9e22531fcc92d0ef7c9d718c1c813507ac17c6b3a7e7a64bd419237f05",
      "bytes": 216
    },
    {
      "path": "blobs/86b3f938d19238ca4ffc5f91df686576eb43da1393005f631dd2f3d1f6fe5b55",
      "sha256": "86b3f938d19238ca4ffc5f91df686576eb43da1393005f631dd2f3d1f6fe5b55",
      "bytes": 136
    },
    {
      "path": "blobs/95b8c5f698e1c411ad0e375e14c7ddb82a8667b04922733a1712f7356a1010d0",
      "sha256": "95b8c5f698e1c411ad0e375e14c7ddb82a8667b04922733a1712f7356a1010d0",
      "bytes": 577
    },
    {
      "path": "blobs/9e16d97528962968c764559ce2067087b00bca362a0fcfa0914d31b78cabf3ab",
      "sha256": "9e16d97528962968c764559ce2067087b00bca362a0fcfa0914d31b78cabf3ab",
      "bytes": 10240
    },
    {
      "path": "blobs/a22c9f985a55a17c5d80bcced0e8b971b2b6428bdb688d7734b5b92c30498054",
      "sha256": "a22c9f985a55a17c5d80bcced0e8b971b2b6428bdb688d7734b5b92c30498054",
      "bytes": 140
    },
    {
      "path": "blobs/a3d2651957f21810eb833386c095e6151e65939b00ef9a7bc1f5809d0c055514",
      "sha256": "a3d2651957f21810eb833386c095e6151e65939b00ef9a7bc1f5809d0c055514",
      "bytes": 241
    },
    {
      "path": "blobs/cf33f6d39a2660e26d41d748b3a6d5fa385ebffdc6c28d7faf43acd646c491d5",
      "sha256": "cf33f6d39a2660e26d41d748b3a6d5fa385ebffdc6c28d7faf43acd646c491d5",
      "bytes": 200
    },
    {
      "path": "blobs/d5f358af91c3a60daa9edb7e4af8a15e4fbba3cc041a01195d803d8af110bf8c",
      "sha256": "d5f358af91c3a60daa9edb7e4af8a15e4fbba3cc041a01195d803d8af110bf8c",
      "bytes": 136
    },
    {
      "path": "blobs/e10dce9a9d3fd43d8a90cb01237247350d4d23a951005ce81b96cdfbf6e78bc4",
      "sha256": "e10dce9a9d3fd43d8a90cb01237247350d4d23a951005ce81b96cdfbf6e78bc4",
      "bytes": 170
    }
  ],
  "splits": {
    "train": [
      "traj-2026-08-02-demo-001"
    ],
    "validation": [],
    "test": []
  },
  "rights_summary": {
    "status": "cleared",
    "owners": [
      "UALF example author"
    ],
    "license": "Apache-2.0",
    "reviewed_by": "example-human-reviewer",
    "reviewed_at": "2026-08-02T18:00:10.900Z",
    "evidence": {
      "path": "rights-attestation.json",
      "sha256": "19f169128e1fa75dc7468531c4c5cd735fdd15fbcbead10cd07193291f081ab7",
      "bytes": 1158
    }
  },
  "deduplication": {
    "method": "exact-sha256/v1",
    "exact_duplicates_remaining": 0,
    "near_duplicate_method": "minhash-jaccard/v1",
    "near_duplicates_reviewed": 0,
    "benchmark_contamination": "none_detected",
    "split_leakage": "none_detected",
    "report": {
      "path": "dedup-report.json",
      "sha256": "0b66886110768f129b0250d4e687f1f2428df2eafa878cadb3a9535141eb4616",
      "bytes": 316
    }
  },
  "quality_report": {
    "path": "example-quality-report.json",
    "sha256": "4cd35639e1dbe694f25b65de22ad41d7fe2bb942e91cdadc730486ebc6cfeaeb",
    "bytes": 1105
  },
  "datasheet": {
    "path": "datasheet.md",
    "sha256": "da8e21c3602a965cbaa77f9d51171556a94d4a070520935ae892f1b0520c2f8b",
    "bytes": 610
  },
  "machine_datasheet": {
    "path": "example-datasheet.json",
    "sha256": "b5fe81f88e158cd2e2ccb9c2f3f25b94d798101d761723104a84a3f8b7a0d944",
    "bytes": 953
  },
  "provenance": {
    "signing": {
      "key_id": "ualf-demo-16b3559f4e4733ce",
      "algorithm": "ed25519",
      "public_key": "TjpfA7cxiC9KrpweBmwgbOJl+/Yo4CatczPWHRG28DA="
    }
  },
  "seal": {
    "manifest_sha256": "b92c4e46f62be15891ba56ba71729e2e65f5c2f6d39bbd6a9f860c5e03e67995",
    "signature": {
      "key_id": "ualf-demo-16b3559f4e4733ce",
      "algorithm": "ed25519",
      "value": "2DUQ561/W7J+2WX0BYSyFudnIOlJAyzUGaN11csb5uWNI7ADnqbJriYd4V9dmugcrhJ9pGRfosUfr4eoMBQ5AQ=="
    }
  }
}
